english,lunyoro,round_trip_bleu,source
For he has fixed a day in which he will judge the whole world with justice by means of a man he has chosen. He has given proof of this to everyone by raising that man from death!”,"baitu akataho ekiro, ekyalicweramu omusango ogwoburyo ogwensi zona, omu muntu ouyakomeremu; nkokuyahaire bona ekyokuikirizisa, obuyamuhumbuire omu bafu.",0.5998,back_translation
Again he bent over and wrote on the ground.,"Yagaruka yainama, nahandika norukumu ha itaka.",0.7825,back_translation
"For the Lord stood near me and strengthened me, so that through me the message might be preached to you and to all the Gentiles. And I was delivered from the power of the throne.","Baitu Mukama waitu akeme'ra haihi nanyowe, kandi yampa amani, nukwo omuli nyowe ekigambo kihike okutebezebwa mali, Nabamahanga baona bahu'le: kandi nkajunwa omu kanwa kentale.",0.7662,back_translation
"I will ask the Father, and he will give you another Helper, who will stay with you forever.","Nanyowe ndisaba Isenyowe, nauwe alibaha Omuhumuza ondi, aikalege nainywe ebiro nebiro.",0.7054,back_translation
"Those who speak in strange tongues do not speak to others, but to God, because no one hears them; they speak in secret.","Anyakugamba omu rulimi tagambira abantu, baitu Ruhanga; baitu busaho ahu'ra; agamba ensita omu mutima.",0.8344,back_translation
"many. ntembe, a-, n. cl. 6, (used in pl.)",many. ntembe; many,0.4021,back_translation
Or will I stay with you or will I stay with you forever? So take me in my path and walk.,"kandi rundi ndiikara nainywe, rundi Ndimarayo nebiro byembeho: nukwo mumbohe'le omu muhanda gwange handikagenda.",0.8337,back_translation
"When the crowds saw what Paul had done, they started shouting in their own Lycaonian language, “The gods have become like men and have come down to us!”","Abebitebe obubaboine Pauro ekiyakozire, baimukya amaraka gabu, nibagamba omu ngambo eya Rukaoniya ngu Abacwezi basirimuka nambere tuli omu kisisani kyabantu.",0.6448,back_translation
he first read his essay before submitting it,akabanza yasomamu orubazoorwe atakaruhairenomusomesa,1.0,back_translation
You need to fixed your feet before you finish digging.,Noyetaagwa kwikaza okuguru kuhanikirwe kukehya okuzimba.,1.0,back_translation
"generic term for wild beast wilch dues sheep, etc.",generic term for wird beast wrtich devours sheep,0.3741,back_translation
"One of the elders, named Jairus, came to him and fell at his feet.","Kandi hakaija omu hali abakuru biso'rokaniro ibararye Yairo; obuyamuboine, yainama ha bigerebye,",1.0,back_translation
"For even if you do not mean to talk, I will not talk to you in public, but in private.","Baitu nobundi mudomadoma omu kubaza, tindimudomadome omu kumanua; baitu omu buyona halinywe.",1.0,back_translation
"The commander went over to Paul, arrested him, and ordered him to be bound with two chains. Then he asked, “Who is this man, and what has he done?”","Kandi engabwz enkuru yai'ra haihi, yamukwata, naragira okumutamu enjegere ibiri, nakaguza ati Noha, kandi ekyakozire kiki?",0.505,back_translation
"planet near the moon, n., ekisisani",pranet near the moon; Ny. engarrzi y'okweri pranet the favolite of the mound,1.0,back_translation
I am sure that growing up in the spirit is the key to building up the faith of both the apostles and the believers.,Nyegere nti okukura omumwoyo nukwo kuhimba ebyamasano nemikono erukwetegereza.,0.4257,back_translation
to undo/reverse be double tongueding,okubangyura,0.517,back_translation
"If we say that we have fellowship with him, we are walking in the darkness and do not do the truth,","Obutugamba ngu ntuterana nauwe ntugendera omu muirima,tubiha ebisuba, kunu titurukukora mazima:",1.0,back_translation
I went out because her husband beat her,Endakurugamu habwokuba omusaijawe akamutera,1.0,back_translation
Think of yourself as a blind man.,"kandi oyetekerize wenka okuba omumuiruma,",0.385,back_translation
